{
  "$schema": "https://json-schema.org/draft/2020-12/schema",
  "$id": "https://forge-autocompiler.local/schemas/forge-multi-checkpoint-zero-provider-gate.schema.json",
  "title": "Forge multi-checkpoint zero-provider gate",
  "type": "object",
  "additionalProperties": false,
  "required": [
    "$schema",
    "schema_version",
    "document_type",
    "authorization",
    "fault",
    "cases",
    "historical_components"
  ],
  "properties": {
    "$schema": {"type": "string", "const": "../schemas/forge-multi-checkpoint-zero-provider-gate.schema.json"},
    "schema_version": {"type": "string", "const": "forge-multi-checkpoint-zero-provider-gate-1.0.0"},
    "document_type": {"type": "string", "const": "forge_multi_checkpoint_zero_provider_gate"},
    "authorization": {
      "type": "object",
      "additionalProperties": false,
      "required": [
        "issue_url",
        "provider_calls_authorized",
        "formal_attempts_authorized",
        "model_tokens_authorized",
        "pilot_collection_authorized"
      ],
      "properties": {
        "issue_url": {"type": "string", "const": "https://github.com/WWFXL/Forge-AutoCompiler/issues/168"},
        "provider_calls_authorized": {"type": "boolean", "const": false},
        "formal_attempts_authorized": {"type": "boolean", "const": false},
        "model_tokens_authorized": {"type": "integer", "const": 0},
        "pilot_collection_authorized": {"type": "boolean", "const": false}
      }
    },
    "fault": {
      "type": "object",
      "additionalProperties": false,
      "required": ["family", "expected_classification", "replay_attempts_required", "required_artifacts_per_case"],
      "properties": {
        "family": {"type": "string", "const": "artifact_staging_missing"},
        "expected_classification": {"type": "string", "const": "candidate_verification_failed"},
        "replay_attempts_required": {"type": "integer", "const": 0},
        "required_artifacts_per_case": {"type": "integer", "const": 1}
      }
    },
    "cases": {
      "type": "array",
      "minItems": 3,
      "maxItems": 3,
      "items": {"$ref": "#/$defs/case"}
    },
    "historical_components": {
      "type": "object",
      "minProperties": 4,
      "additionalProperties": {
        "type": "string",
        "pattern": "^[0-9a-f]{64}$"
      }
    }
  },
  "$defs": {
    "artifact": {
      "type": "object",
      "additionalProperties": false,
      "required": ["build_output_relative_path", "staged_relative_path", "artifact_type"],
      "properties": {
        "build_output_relative_path": {"type": "string", "pattern": "^[A-Za-z0-9._/+\\-]+$"},
        "staged_relative_path": {"type": "string", "pattern": "^[A-Za-z0-9._+\\-]+$"},
        "artifact_type": {"type": "string", "enum": ["executable", "static_library"]}
      }
    },
    "command": {
      "type": "object",
      "additionalProperties": false,
      "required": ["role", "command"],
      "properties": {
        "role": {"type": "string", "enum": ["dependency_setup", "configure", "build", "artifact_stage"]},
        "command": {"type": "string", "minLength": 1, "maxLength": 300, "pattern": "^[^\\r\\n]+$"}
      }
    },
    "case": {
      "type": "object",
      "additionalProperties": false,
      "required": [
        "case_id",
        "role",
        "repository_url",
        "commit_sha",
        "language",
        "build_system",
        "source_subdir",
        "build_targets",
        "required_system_packages",
        "cmake_arguments",
        "configure_arguments",
        "artifact",
        "commands"
      ],
      "properties": {
        "case_id": {"type": "string", "pattern": "^[a-z0-9-]+$"},
        "role": {"type": "string", "enum": ["anchor", "new_gate"]},
        "repository_url": {"type": "string", "pattern": "^https://github\\.com/[A-Za-z0-9_.-]+/[A-Za-z0-9_.-]+$"},
        "commit_sha": {"type": "string", "pattern": "^[0-9a-f]{40}$"},
        "language": {"type": "string", "enum": ["C", "C++"]},
        "build_system": {"type": "string", "enum": ["cmake", "make", "autotools"]},
        "source_subdir": {"type": "string", "pattern": "^(\\.|[A-Za-z0-9._/+-]+)$"},
        "build_targets": {"type": "array", "minItems": 1, "items": {"type": "string", "pattern": "^[A-Za-z0-9._+\\-]+$"}},
        "required_system_packages": {"type": "array", "uniqueItems": true, "items": {"type": "string", "pattern": "^[a-z0-9.+-]+$"}},
        "cmake_arguments": {"type": "array", "items": {"type": "string"}},
        "configure_arguments": {"type": "array", "items": {"type": "string"}},
        "artifact": {"$ref": "#/$defs/artifact"},
        "commands": {"type": "array", "minItems": 2, "items": {"$ref": "#/$defs/command"}}
      }
    }
  }
}
