{
  "$schema": "../schemas/forge-multi-checkpoint-zero-provider-gate.schema.json",
  "schema_version": "forge-multi-checkpoint-zero-provider-gate-1.0.0",
  "document_type": "forge_multi_checkpoint_zero_provider_gate",
  "authorization": {
    "issue_url": "https://github.com/WWFXL/Forge-AutoCompiler/issues/168",
    "provider_calls_authorized": false,
    "formal_attempts_authorized": false,
    "model_tokens_authorized": 0,
    "pilot_collection_authorized": false
  },
  "fault": {
    "family": "artifact_staging_missing",
    "expected_classification": "candidate_verification_failed",
    "replay_attempts_required": 0,
    "required_artifacts_per_case": 1
  },
  "cases": [
    {
      "case_id": "cppitertools",
      "role": "anchor",
      "repository_url": "https://github.com/ryanhaining/cppitertools",
      "commit_sha": "531b3d753d2bbfe3b0ababe61c2e95e965c54a66",
      "language": "C++",
      "build_system": "cmake",
      "source_subdir": "examples",
      "build_targets": ["accumulate_examples"],
      "required_system_packages": ["build-essential", "cmake"],
      "cmake_arguments": ["-DCMAKE_BUILD_TYPE=Release"],
      "configure_arguments": [],
      "artifact": {
        "build_output_relative_path": ".forge-cmake-build/accumulate_examples",
        "staged_relative_path": "accumulate_examples",
        "artifact_type": "executable"
      },
      "commands": [
        {"role": "dependency_setup", "command": "dpkg-query -W build-essential cmake"},
        {"role": "configure", "command": "cmake -S examples -B .forge-cmake-build -DCMAKE_BUILD_TYPE=Release"},
        {"role": "build", "command": "cmake --build .forge-cmake-build --target accumulate_examples -j2"},
        {"role": "artifact_stage", "command": "cp .forge-cmake-build/accumulate_examples /artifacts/accumulate_examples"}
      ]
    },
    {
      "case_id": "janet",
      "role": "new_gate",
      "repository_url": "https://github.com/janet-lang/janet",
      "commit_sha": "c0b32d4e3798d0ceaf4131e642e59602a31ce151",
      "language": "C",
      "build_system": "make",
      "source_subdir": ".",
      "build_targets": ["all"],
      "required_system_packages": ["build-essential"],
      "cmake_arguments": [],
      "configure_arguments": [],
      "artifact": {
        "build_output_relative_path": "build/libjanet.a",
        "staged_relative_path": "libjanet.a",
        "artifact_type": "static_library"
      },
      "commands": [
        {"role": "dependency_setup", "command": "dpkg-query -W build-essential"},
        {"role": "build", "command": "make -j2"},
        {"role": "artifact_stage", "command": "cp build/libjanet.a /artifacts/libjanet.a"}
      ]
    },
    {
      "case_id": "libcheck",
      "role": "new_gate",
      "repository_url": "https://github.com/libcheck/check",
      "commit_sha": "11970a7e112dfe243a2e68773f014687df2900e8",
      "language": "C",
      "build_system": "autotools",
      "source_subdir": ".",
      "build_targets": ["all"],
      "required_system_packages": ["autoconf", "automake", "build-essential", "libtool", "pkg-config", "texinfo"],
      "cmake_arguments": [],
      "configure_arguments": ["--disable-subunit"],
      "artifact": {
        "build_output_relative_path": "src/.libs/libcheck.a",
        "staged_relative_path": "libcheck.a",
        "artifact_type": "static_library"
      },
      "commands": [
        {"role": "dependency_setup", "command": "apt-get update && apt-get install -y --no-install-recommends texinfo"},
        {"role": "configure", "command": "autoreconf -fi && ./configure --disable-subunit"},
        {"role": "build", "command": "make -j2"},
        {"role": "artifact_stage", "command": "cp src/.libs/libcheck.a /artifacts/libcheck.a"}
      ]
    }
  ],
  "historical_components": {
    "benchmarks/manifests/cpp-verifier-checkpoint-behavioral-pilot-v2.json": "fb803eac7189dbc697a6fdf9bddac1f9ae4a0ec262cf548f62360cd6ad762f2e",
    "scripts/forge_checkpoint_behavioral_pilot_v2_runner.py": "82a041ea3c7a8de762a014aaf405ccb10e62e1baaa5a79d22548c8af98dccd95",
    "scripts/forge_checkpoint_primary_canary.py": "031bac753459a060e134df765a27eaa1c8fca0ac784f239d46e243f89c8b3282",
    "scripts/forge_controlled_fault_v1_gate.py": "3dd4b2495cb21594f9348aaf8416dc17c57f6aa850f14b739049b030bc4d9f2d"
  }
}
